<?xml version="1.0" ?>

<!DOCTYPE calificaciones SYSTEM "ejercicio2.dtd">

<calificaciones convocatoria="febrero" curso="2017" asignatura="1902">
  	<calificacion>
        	<nif>23322156M</nif>
        	<nota>10</nota>
  	</calificacion>  
  	<calificacion>
        	<nif>13322156M</nif>
        	<nombre>Pepe</nombre>  
        	<nota>8</nota>
  	</calificacion>  
  	<diligencia fecha="2019-02-05">
        	<nif>13322156M</nif>
        	<nota>9</nota>	
  	</diligencia>
</calificaciones>    
